{
  "version": "1.1",
  "generated_on": "2025-10-05T00:00:00+09:00",
  "source_refs": [
    "子平眞詮 (Ziping Zhenquan), 中華書局註解本",
    "三命通會 (Sanming Tonghui), 中華書局",
    "滴天髓 (Di Tian Sui), 上海古籍",
    "窮通寶鑑 (Qiong Tong Bao Jian), 臺灣商務"
  ],
  "mappings": {
    "甲": {
      "子": "沐浴",
      "丑": "冠帶",
      "寅": "臨官",
      "卯": "帝旺",
      "辰": "衰",
      "巳": "病",
      "午": "死",
      "未": "墓",
      "申": "絕",
      "酉": "胎",
      "戌": "養",
      "亥": "長生"
    },
    "乙": {
      "子": "病",
      "丑": "衰",
      "寅": "帝旺",
      "卯": "臨官",
      "辰": "冠帶",
      "巳": "沐浴",
      "午": "長生",
      "未": "養",
      "申": "胎",
      "酉": "絕",
      "戌": "墓",
      "亥": "死"
    },
    "丙": {
      "子": "胎",
      "丑": "養",
      "寅": "長生",
      "卯": "沐浴",
      "辰": "冠帶",
      "巳": "臨官",
      "午": "帝旺",
      "未": "衰",
      "申": "病",
      "酉": "死",
      "戌": "墓",
      "亥": "絕"
    },
    "丁": {
      "子": "絕",
      "丑": "墓",
      "寅": "死",
      "卯": "病",
      "辰": "衰",
      "巳": "帝旺",
      "午": "臨官",
      "未": "冠帶",
      "申": "沐浴",
      "酉": "長生",
      "戌": "養",
      "亥": "胎"
    },
    "戊": {
      "子": "胎",
      "丑": "養",
      "寅": "長生",
      "卯": "沐浴",
      "辰": "冠帶",
      "巳": "臨官",
      "午": "帝旺",
      "未": "衰",
      "申": "病",
      "酉": "死",
      "戌": "墓",
      "亥": "絕"
    },
    "己": {
      "子": "絕",
      "丑": "墓",
      "寅": "死",
      "卯": "病",
      "辰": "衰",
      "巳": "帝旺",
      "午": "臨官",
      "未": "冠帶",
      "申": "沐浴",
      "酉": "長生",
      "戌": "養",
      "亥": "胎"
    },
    "庚": {
      "子": "死",
      "丑": "墓",
      "寅": "絕",
      "卯": "胎",
      "辰": "養",
      "巳": "長生",
      "午": "沐浴",
      "未": "冠帶",
      "申": "臨官",
      "酉": "帝旺",
      "戌": "衰",
      "亥": "病"
    },
    "辛": {
      "子": "長生",
      "丑": "養",
      "寅": "胎",
      "卯": "絕",
      "辰": "墓",
      "巳": "死",
      "午": "病",
      "未": "衰",
      "申": "帝旺",
      "酉": "臨官",
      "戌": "冠帶",
      "亥": "沐浴"
    },
    "壬": {
      "子": "帝旺",
      "丑": "衰",
      "寅": "病",
      "卯": "死",
      "辰": "墓",
      "巳": "絕",
      "午": "胎",
      "未": "養",
      "申": "長生",
      "酉": "沐浴",
      "戌": "冠帶",
      "亥": "臨官"
    },
    "癸": {
      "子": "臨官",
      "丑": "冠帶",
      "寅": "沐浴",
      "卯": "長生",
      "辰": "養",
      "巳": "胎",
      "午": "絕",
      "未": "墓",
      "申": "死",
      "酉": "病",
      "戌": "衰",
      "亥": "帝旺"
    }
  },
  "labels": {
    "zh": [
      "長生",
      "沐浴",
      "冠帶",
      "臨官",
      "帝旺",
      "衰",
      "病",
      "死",
      "墓",
      "絕",
      "胎",
      "養"
    ],
    "ko": [
      "장생",
      "목욕",
      "관대",
      "임관",
      "제왕",
      "쇠",
      "병",
      "사",
      "묘",
      "절",
      "태",
      "양"
    ],
    "en": [
      "Birth",
      "Bath",
      "Crown",
      "Office",
      "Peak",
      "Decline",
      "Sickness",
      "Death",
      "Tomb",
      "Extinction",
      "Embryo",
      "Nurture"
    ]
  }
}
